article_id,title,link,keywords,creator,description,content,pubDate,pubDateTZ,image_url,video_url,source_id,source_name,source_priority,source_url,source_icon,language,country,category,sentiment,sentiment_stats,ai_tag,ai_region,ai_org,ai_summary,ai_content,duplicate
5d73bd169ad5dba7c4037cb7d8f1435a,BYT’s Grow Up! at The Drill Hall Theatre,https://www.echo.net.au/2025/10/byts-grow-up-at-the-drill-hall-theatre/,"['local news', 'featured', 'byron echo', 'byron youth theatre', 'drill hall theatre']",['The Echo'],"Byron Youth Theatre (BYT) will premiere its powerful new original production, Grow Up!, at The Drill Hall Theatre, Mullumbimby this October.The post BYT’s Grow Up! at The Drill Hall Theatre appeared first on The Echo.",ONLY AVAILABLE IN PAID PLANS,2025-10-03 00:07:57,UTC,https://www.echo.net.au/wp-content/uploads/2025/10/1200for-28th-Grow-Up.gif,,echo_au,The Echo,238443,https://www.echo.net.au,https://n.bytvi.com/echo_au.png,english,['australia'],"['entertainment', 'top']",ONLY AVAILABLE IN PROFESSIONAL AND CORPORATE PLANS,ONLY AVAILABLE IN PROFESSIONAL AND CORPORATE PLANS,ONLY AVAILABLE IN PROFESSIONAL AND CORPORATE PLANS,ONLY AVAILABLE IN CORPORATE PLANS,ONLY AVAILABLE IN CORPORATE PLANS,ONLY AVAILABLE IN PAID PLANS,ONLY AVAILABLE IN PROFESSIONAL AND CORPORATE PLANS,False
ddd5695f6f1676a7c06b3a09730b186b,"Stick together, win it all: Broncos Grand Final plan",https://www.espn.com.au/nrl/story/_/id/46469734/nrl-brisbane-broncos-grand-final-plan-stick-together-win-all,,['Joel Spreadborough'],"Melbourne Storm win a lot more than they lose against the Broncos, and are peaking at a pretty decent time, but the Broncos have enough self-belief to overcome the purple clad bogey men.",ONLY AVAILABLE IN PAID PLANS,2025-10-03 00:07:57,UTC,https://a.espncdn.com/combiner/i?cquality=80&format=jpg&h=530&img=%2Fmedia%2Fmotion%2F2025%2F0930%2FInt_250930_NRL_Analysis_Nighttime_Grand_Final_could_severely_impact_the_Broncos_20251001_AUS%2FInt_250930_NRL_Analysis_Nighttime_Grand_Final_could_severely_impact_the_Broncos_20251001_AUS.jpg&w=943,,espn_au,Espn Australia,36109,https://www.espn.com.au,https://n.bytvi.com/espn_au.png,english,['australia'],['sports'],ONLY AVAILABLE IN PROFESSIONAL AND CORPORATE PLANS,ONLY AVAILABLE IN PROFESSIONAL AND CORPORATE PLANS,ONLY AVAILABLE IN PROFESSIONAL AND CORPORATE PLANS,ONLY AVAILABLE IN CORPORATE PLANS,ONLY AVAILABLE IN CORPORATE PLANS,ONLY AVAILABLE IN PAID PLANS,ONLY AVAILABLE IN PROFESSIONAL AND CORPORATE PLANS,False
a431750ba4c44d8f8c52fbac4c3e6d19,They wanted a new kind of musical. Its success had nothing to do with luck,https://www.smh.com.au/culture/musicals/they-wanted-a-new-kind-of-musical-its-success-had-nothing-to-do-with-luck-20250929-p5mymt.html,['culture / musicals'],['John Bailey'],Vidya Makan and Sonya Suares struggled to find a place on Australian stages. So they made their own.,ONLY AVAILABLE IN PAID PLANS,2025-10-03 00:07:09,UTC,"https://static.ffx.io/images/$zoom_0.4254,$multiply_0.7554,$ratio_1.777778,$width_1059,$x_751,$y_249/t_crop_custom/q_86,f_auto/1d1526a74b664062b2f0ef8b4ef3ab1336c91f6b",,smh,The Sydney Morning Herald,2251,https://www.smh.com.au,https://n.bytvi.com/smh.png,english,['australia'],"['entertainment', 'top']",ONLY AVAILABLE IN PROFESSIONAL AND CORPORATE PLANS,ONLY AVAILABLE IN PROFESSIONAL AND CORPORATE PLANS,ONLY AVAILABLE IN PROFESSIONAL AND CORPORATE PLANS,ONLY AVAILABLE IN CORPORATE PLANS,ONLY AVAILABLE IN CORPORATE PLANS,ONLY AVAILABLE IN PAID PLANS,ONLY AVAILABLE IN PROFESSIONAL AND CORPORATE PLANS,True
ffb917dcba1136741263e621beb75211,They wanted a new kind of musical. Its success had nothing to do with luck,https://www.watoday.com.au/culture/musicals/they-wanted-a-new-kind-of-musical-its-success-had-nothing-to-do-with-luck-20250929-p5mymt.html,['culture / musicals'],['John Bailey'],Vidya Makan and Sonya Suares struggled to find a place on Australian stages. So they made their own.,ONLY AVAILABLE IN PAID PLANS,2025-10-03 00:07:09,UTC,"https://static.ffx.io/images/$zoom_0.4254,$multiply_0.7554,$ratio_1.777778,$width_1059,$x_751,$y_249/t_crop_custom/q_86,f_auto/1d1526a74b664062b2f0ef8b4ef3ab1336c91f6b",,watoday,Watoday,347743,https://www.watoday.com.au,https://n.bytvi.com/watoday.png,english,['australia'],['entertainment'],ONLY AVAILABLE IN PROFESSIONAL AND CORPORATE PLANS,ONLY AVAILABLE IN PROFESSIONAL AND CORPORATE PLANS,ONLY AVAILABLE IN PROFESSIONAL AND CORPORATE PLANS,ONLY AVAILABLE IN CORPORATE PLANS,ONLY AVAILABLE IN CORPORATE PLANS,ONLY AVAILABLE IN PAID PLANS,ONLY AVAILABLE IN PROFESSIONAL AND CORPORATE PLANS,True
b51af1c41a1cfc8ee0c1d297f910b418,They wanted a new kind of musical. Its success had nothing to do with luck,https://www.brisbanetimes.com.au/culture/musicals/they-wanted-a-new-kind-of-musical-its-success-had-nothing-to-do-with-luck-20250929-p5mymt.html,['culture / musicals'],['John Bailey'],Vidya Makan and Sonya Suares struggled to find a place on Australian stages. So they made their own.,ONLY AVAILABLE IN PAID PLANS,2025-10-03 00:07:09,UTC,"https://static.ffx.io/images/$zoom_0.4254,$multiply_0.7554,$ratio_1.777778,$width_1059,$x_751,$y_249/t_crop_custom/q_86,f_auto/1d1526a74b664062b2f0ef8b4ef3ab1336c91f6b",,brisbanetimes,Brisbane Times,22163,https://www.brisbanetimes.com.au,https://n.bytvi.com/brisbanetimes.png,english,['australia'],['entertainment'],ONLY AVAILABLE IN PROFESSIONAL AND CORPORATE PLANS,ONLY AVAILABLE IN PROFESSIONAL AND CORPORATE PLANS,ONLY AVAILABLE IN PROFESSIONAL AND CORPORATE PLANS,ONLY AVAILABLE IN CORPORATE PLANS,ONLY AVAILABLE IN CORPORATE PLANS,ONLY AVAILABLE IN PAID PLANS,ONLY AVAILABLE IN PROFESSIONAL AND CORPORATE PLANS,True
c8b19d6e9f72077e65f33379f1ffe4d6,They wanted a new kind of musical. Its success had nothing to do with luck,https://www.theage.com.au/culture/musicals/they-wanted-a-new-kind-of-musical-its-success-had-nothing-to-do-with-luck-20250929-p5mymt.html,['culture / musicals'],['John Bailey'],Vidya Makan and Sonya Suares struggled to find a place on Australian stages. So they made their own.,ONLY AVAILABLE IN PAID PLANS,2025-10-03 00:07:09,UTC,"https://static.ffx.io/images/$zoom_0.4254,$multiply_0.7554,$ratio_1.777778,$width_1059,$x_751,$y_249/t_crop_custom/q_86,f_auto/1d1526a74b664062b2f0ef8b4ef3ab1336c91f6b",,theage,The Age,44145,https://www.theage.com.au,https://n.bytvi.com/theage.png,english,['australia'],['entertainment'],ONLY AVAILABLE IN PROFESSIONAL AND CORPORATE PLANS,ONLY AVAILABLE IN PROFESSIONAL AND CORPORATE PLANS,ONLY AVAILABLE IN PROFESSIONAL AND CORPORATE PLANS,ONLY AVAILABLE IN CORPORATE PLANS,ONLY AVAILABLE IN CORPORATE PLANS,ONLY AVAILABLE IN PAID PLANS,ONLY AVAILABLE IN PROFESSIONAL AND CORPORATE PLANS,False
36d745e3b65038ab31a3e6a0bcb5894d,Chinatown’s Jumbo Seafood Expanding to Brookline,https://whatnow.com/boston/restaurants/chinatowns-jumbo-seafood-expanding-to-brookline/,"['catherence chan', 'jumbo seafood', 'brookline', 'kenneth leung', 'restaurants', 'commonwealth avenue']",['Cat Broughton'],A longtime Chinatown eatery is bringing its Hong Kong-style seafood dishes to Commonwealth Avenue.,ONLY AVAILABLE IN PAID PLANS,2025-10-03 00:06:53,UTC,https://whatnow.com/wp-content/uploads/2025/10/Jumbo-Seafood.jpg,,whatnowaus,What Now Austin,576327,https://whatnowaus.com,https://n.bytvi.com/whatnowaus.png,english,['australia'],['business'],ONLY AVAILABLE IN PROFESSIONAL AND CORPORATE PLANS,ONLY AVAILABLE IN PROFESSIONAL AND CORPORATE PLANS,ONLY AVAILABLE IN PROFESSIONAL AND CORPORATE PLANS,ONLY AVAILABLE IN CORPORATE PLANS,ONLY AVAILABLE IN CORPORATE PLANS,ONLY AVAILABLE IN PAID PLANS,ONLY AVAILABLE IN PROFESSIONAL AND CORPORATE PLANS,False
7e9adeb2066d505324e52446dc69a725,‘Wants his mum’: Desperate search for missing 4yo in remote South Australia enters 7th day,https://thewest.com.au/news/wants-his-mum-desperate-search-for-missing-4yo-in-remote-south-australia-enters-7th-day-c-20222175,"['tas news', 'sa news', 'australia', 'news']",['Alexandra Feiam'],"The four-year-old wandered off a remote property on Saturday afternoon, with police holding grave fears as the search enters its seventh day.",ONLY AVAILABLE IN PAID PLANS,2025-10-03 00:06:09,UTC,https://images.thewest.com.au/publication/C-20222175/29714fc05f4e02caad794e5cdb84bbb2ece0f99c-16x9-x0y96w1024h576.jpg,,thewest,The West,106740,https://thewest.com.au,https://n.bytvi.com/thewest.png,english,['australia'],"['crime', 'top']",ONLY AVAILABLE IN PROFESSIONAL AND CORPORATE PLANS,ONLY AVAILABLE IN PROFESSIONAL AND CORPORATE PLANS,ONLY AVAILABLE IN PROFESSIONAL AND CORPORATE PLANS,ONLY AVAILABLE IN CORPORATE PLANS,ONLY AVAILABLE IN CORPORATE PLANS,ONLY AVAILABLE IN PAID PLANS,ONLY AVAILABLE IN PROFESSIONAL AND CORPORATE PLANS,True
884e43a018cf01ebf1436e594c40fa17,ASX 200 bank announces key change to upcoming FY25 result,https://www.fool.com.au/2025/10/03/asx-200-bank-announces-key-change-to-upcoming-fy25-result/,['share market news'],['Laura Stewart'],Bank of Queensland is set to release its FY25 results on 15 October.The post ASX 200 bank announces key change to upcoming FY25 result appeared first on The Motley Fool Australia.,ONLY AVAILABLE IN PAID PLANS,2025-10-03 00:05:57,UTC,https://www.fool.com.au/wp-content/uploads/2024/08/white-board-16.9-1200x675.jpg,,fool_au,Fool Australia,147513,https://www.fool.com.au,https://n.bytvi.com/fool_au.png,english,['australia'],"['business', 'top']",ONLY AVAILABLE IN PROFESSIONAL AND CORPORATE PLANS,ONLY AVAILABLE IN PROFESSIONAL AND CORPORATE PLANS,ONLY AVAILABLE IN PROFESSIONAL AND CORPORATE PLANS,ONLY AVAILABLE IN CORPORATE PLANS,ONLY AVAILABLE IN CORPORATE PLANS,ONLY AVAILABLE IN PAID PLANS,ONLY AVAILABLE IN PROFESSIONAL AND CORPORATE PLANS,False
5378dd96c375df957111c7c18e3d9f9b,Emily Blunt’s children largely unimpressed by her Hollywood career,https://www.perthnow.com.au/entertainment/celebrity-gossip/emily-blunts-children-largely-unimpressed-by-her-hollywood-career-c-20222159,"['entertainment', 'celebrity gossip']",['BANG - Entertainment News'],"In a chat with Jimmy Kimmel, actress Emily Blunt has admitted her children are largely unimpressed by her Hollywood career.",ONLY AVAILABLE IN PAID PLANS,2025-10-03 00:05:45,UTC,https://images.perthnow.com.au/publication/C-20222159/de6d1f12a1ac527e0e6b31d0cd011bc243f00783-16x9-x0y192w2048h1152.jpg,,perthnow,Perthnow,49457,https://www.perthnow.com.au,https://n.bytvi.com/perthnow.png,english,['australia'],['entertainment'],ONLY AVAILABLE IN PROFESSIONAL AND CORPORATE PLANS,ONLY AVAILABLE IN PROFESSIONAL AND CORPORATE PLANS,ONLY AVAILABLE IN PROFESSIONAL AND CORPORATE PLANS,ONLY AVAILABLE IN CORPORATE PLANS,ONLY AVAILABLE IN CORPORATE PLANS,ONLY AVAILABLE IN PAID PLANS,ONLY AVAILABLE IN PROFESSIONAL AND CORPORATE PLANS,False
d12b8ebc2ac70dfb9320e14321987a69,Bruce Springsteen inspires hotel suite dedicated to The Boss,https://www.perthnow.com.au/entertainment/celebrity-gossip/bruce-springsteen-inspires-hotel-suite-dedicated-to-the-boss-c-20222158,"['entertainment', 'celebrity gossip']",['BANG - Entertainment News'],"Ahead of the release of his biopic, Bruce Springsteen has been used as the inspiration for a hotel suite.",ONLY AVAILABLE IN PAID PLANS,2025-10-03 00:05:42,UTC,https://images.perthnow.com.au/publication/C-20222158/ac5ceb03632627364533c7c4f22341f10f899693-16x9-x0y192w2048h1152.jpg,,perthnow,Perthnow,49457,https://www.perthnow.com.au,https://n.bytvi.com/perthnow.png,english,['australia'],['entertainment'],ONLY AVAILABLE IN PROFESSIONAL AND CORPORATE PLANS,ONLY AVAILABLE IN PROFESSIONAL AND CORPORATE PLANS,ONLY AVAILABLE IN PROFESSIONAL AND CORPORATE PLANS,ONLY AVAILABLE IN CORPORATE PLANS,ONLY AVAILABLE IN CORPORATE PLANS,ONLY AVAILABLE IN PAID PLANS,ONLY AVAILABLE IN PROFESSIONAL AND CORPORATE PLANS,False
418f85399b4519560c36524a10ea5722,Sleepout at the airport,https://northern.starweekly.com.au/news/sleepout-at-the-airport/,['news'],['jimjin'],"Melbourne Airport is inviting people to swap their beds for their cars to raise awareness and funds for those affected by domestic violence and homelessness. On Thursday, October 16, participants will spend a night sleeping in their car atop Melbourne airport’s T4 carpark for a glimpse into the often harsh reality of hidden homelessness. The [...]",ONLY AVAILABLE IN PAID PLANS,2025-10-03 00:05:40,UTC,https://northern.starweekly.com.au/wp-content/uploads/sites/5/2025/10/Sleepout_507997_01.jpg,,brimbanknorthwest,Brimbank Star Weekly,2256086,https://brimbanknorthwest.starweekly.com.au,https://n.bytvi.com/brimbanknorthwest.jpg,english,['australia'],"['lifestyle', 'top']",ONLY AVAILABLE IN PROFESSIONAL AND CORPORATE PLANS,ONLY AVAILABLE IN PROFESSIONAL AND CORPORATE PLANS,ONLY AVAILABLE IN PROFESSIONAL AND CORPORATE PLANS,ONLY AVAILABLE IN CORPORATE PLANS,ONLY AVAILABLE IN CORPORATE PLANS,ONLY AVAILABLE IN PAID PLANS,ONLY AVAILABLE IN PROFESSIONAL AND CORPORATE PLANS,False
dd2f281bd29fb214fad4fba169768a21,Ozzy Osbourne declares in upcoming posthumous memoir he was left ‘p***** off no end’ by being unable to walk on stage at final gig,https://www.perthnow.com.au/entertainment/celebrity-gossip/ozzy-osbourne-declares-in-upcoming-posthumous-memoir-he-was-left-p-off-no-end-by-being-unable-to-walk-on-stage-at-final-gig-c-20222156,"['entertainment', 'celebrity gossip']",['BANG - Entertainment News'],"In a brutal revelation from his upcoming posthumous memoir, Ozzy Osbourne reveals being forced to sit on a throne during his last-ever concert “p***** me off no end”.",ONLY AVAILABLE IN PAID PLANS,2025-10-03 00:05:38,UTC,https://images.perthnow.com.au/publication/C-20222156/bb1de4ec24b021081783ab6a0d43d722b98ef0d8-16x9-x0y192w2048h1152.jpg,,perthnow,Perthnow,49457,https://www.perthnow.com.au,https://n.bytvi.com/perthnow.png,english,['australia'],['entertainment'],ONLY AVAILABLE IN PROFESSIONAL AND CORPORATE PLANS,ONLY AVAILABLE IN PROFESSIONAL AND CORPORATE PLANS,ONLY AVAILABLE IN PROFESSIONAL AND CORPORATE PLANS,ONLY AVAILABLE IN CORPORATE PLANS,ONLY AVAILABLE IN CORPORATE PLANS,ONLY AVAILABLE IN PAID PLANS,ONLY AVAILABLE IN PROFESSIONAL AND CORPORATE PLANS,False
9a919ac393d178e8f21682199bed5d9a,‘Wants his mum’: Desperate search for missing 4yo in remote South Australia enters 7th day,https://www.perthnow.com.au/news/wants-his-mum-desperate-search-for-missing-4yo-in-remote-south-australia-enters-7th-day-c-20222155,['news'],['Alexandra Feiam'],"The four-year-old wandered off a remote property on Saturday afternoon, with police holding grave fears as the search enters its seventh day.",ONLY AVAILABLE IN PAID PLANS,2025-10-03 00:05:18,UTC,https://images.perthnow.com.au/publication/C-20222155/29714fc05f4e02caad794e5cdb84bbb2ece0f99c-16x9-x0y96w1024h576.jpg,,perthnow,Perthnow,49457,https://www.perthnow.com.au,https://n.bytvi.com/perthnow.png,english,['australia'],"['crime', 'top']",ONLY AVAILABLE IN PROFESSIONAL AND CORPORATE PLANS,ONLY AVAILABLE IN PROFESSIONAL AND CORPORATE PLANS,ONLY AVAILABLE IN PROFESSIONAL AND CORPORATE PLANS,ONLY AVAILABLE IN CORPORATE PLANS,ONLY AVAILABLE IN CORPORATE PLANS,ONLY AVAILABLE IN PAID PLANS,ONLY AVAILABLE IN PROFESSIONAL AND CORPORATE PLANS,False
dfbbe3530be82c5cf71e22e10fadc95f,"Collingwood gun Josh Daicos’ partner rushed to hospital, pulls out of awards",https://www.news.com.au/sport/afl/collingwood-gun-josh-daicos-partner-rushed-to-hospital-pulls-out-of-awards/news-story/d7cc2d0fbca0ad3db7dd2b0850b5af54?from=rss-basic,"['afl', 'sport']",['Tyson Otto'],Collingwood star Josh Daicos’ fiancee has withdrawn from the club’s awards night after being rushed to hospital.,ONLY AVAILABLE IN PAID PLANS,2025-10-03 00:05:00,UTC,https://content.api.news/v3/images/bin/bfb2043c0d7482795433e5d8705e882e,,news,News,3657,https://www.news.com.au,https://n.bytvi.com/news.sk.png,english,['australia'],['sports'],ONLY AVAILABLE IN PROFESSIONAL AND CORPORATE PLANS,ONLY AVAILABLE IN PROFESSIONAL AND CORPORATE PLANS,ONLY AVAILABLE IN PROFESSIONAL AND CORPORATE PLANS,ONLY AVAILABLE IN CORPORATE PLANS,ONLY AVAILABLE IN CORPORATE PLANS,ONLY AVAILABLE IN PAID PLANS,ONLY AVAILABLE IN PROFESSIONAL AND CORPORATE PLANS,False
9401a87be5f92d29ea799cfc4c2cabdc,Geek Warning: Back to basics with chain lubes - Escape Collective,https://news.google.com/rss/articles/CBMikgFBVV95cUxNVWhOd0ZpWXZPTlpJVVpHUVhzMFpkaGZJc2JBZHNuaEVuOVV0dEdZX3NlZUR2MmtVN2MtemlfZTRkN19hVXg1VlFsNUxELVdHN3ZDUnBILW55VzFzN2cxMXNOS21yTnFxMWFQMWY2Nk9UWWJMTGlLcVpTUDlqVUlEZDlrbURpdGEwRFlJMUJ0N1dRdw?oc=5,,,Geek Warning: Back to basics with chain lubes Escape Collective,ONLY AVAILABLE IN PAID PLANS,2025-10-03 00:04:53,UTC,,,google,Google News,14,https://news.google.com,https://n.bytvi.com/google.png,english,['australia'],['technology'],ONLY AVAILABLE IN PROFESSIONAL AND CORPORATE PLANS,ONLY AVAILABLE IN PROFESSIONAL AND CORPORATE PLANS,ONLY AVAILABLE IN PROFESSIONAL AND CORPORATE PLANS,ONLY AVAILABLE IN CORPORATE PLANS,ONLY AVAILABLE IN CORPORATE PLANS,ONLY AVAILABLE IN PAID PLANS,ONLY AVAILABLE IN PROFESSIONAL AND CORPORATE PLANS,False
618cd219cf441048da2f186131a2cbb6,Spring is in the air,https://realestate.noosatoday.com.au/property-news/2025/10/03/spring-is-in-the-air/,['property news'],['Jin Hui'],Spring: a time for renewal and when everything is alive. A time of plans and projects – especially property – [...]The post Spring is in the air appeared first on Noosa Today Real Estate Lifestyle.,ONLY AVAILABLE IN PAID PLANS,2025-10-03 00:03:18,UTC,https://realestate.noosatoday.com.au/wp-content/uploads/sites/3/2025/10/0310NTPROP_503562_14.jpg,,noosatoday,Noosa Today,888404,https://noosatoday.com.au,https://n.bytvi.com/noosatoday.jpeg,english,['australia'],"['business', 'other']",ONLY AVAILABLE IN PROFESSIONAL AND CORPORATE PLANS,ONLY AVAILABLE IN PROFESSIONAL AND CORPORATE PLANS,ONLY AVAILABLE IN PROFESSIONAL AND CORPORATE PLANS,ONLY AVAILABLE IN CORPORATE PLANS,ONLY AVAILABLE IN CORPORATE PLANS,ONLY AVAILABLE IN PAID PLANS,ONLY AVAILABLE IN PROFESSIONAL AND CORPORATE PLANS,False
c59c909d40abfc002f28017234aaef1c,Key reason Aus and PNG are joining forces,https://www.news.com.au/technology/innovation/military/defence-minister-richard-marles-says-history-fuels-papua-new-guinea-pukpuk-treaty/news-story/60019a7396b233aa3dfa5fe8c9298044?from=rss-basic,"['military', 'technology']",['Duncan Evans'],Defence Minister Richard Marles has revealed a key reason underpinning the dramatic new mutual assistance treaty with PNG.,ONLY AVAILABLE IN PAID PLANS,2025-10-03 00:03:00,UTC,https://content.api.news/v3/images/bin/188df7a2915cc5a9bc80c994780ae175,,news,News,3657,https://www.news.com.au,https://n.bytvi.com/news.sk.png,english,['australia'],['world'],ONLY AVAILABLE IN PROFESSIONAL AND CORPORATE PLANS,ONLY AVAILABLE IN PROFESSIONAL AND CORPORATE PLANS,ONLY AVAILABLE IN PROFESSIONAL AND CORPORATE PLANS,ONLY AVAILABLE IN CORPORATE PLANS,ONLY AVAILABLE IN CORPORATE PLANS,ONLY AVAILABLE IN PAID PLANS,ONLY AVAILABLE IN PROFESSIONAL AND CORPORATE PLANS,False
4961d5b6891ba71ae61501408031a5da,Beachside Penthouse With Exclusive Rooftop Terrace and Panoramic Ocean Views,https://realestate.noosatoday.com.au/properties/2025/10/03/beachside-penthouse-with-exclusive-rooftop-terrace-and-panoramic-ocean-views/,['properties'],['Jin Hui'],"Set atop the captivating Cascades complex in sought-after central Sunshine Beach, Penthouse 11 offers a spectacular combination of lifestyle and [...]The post Beachside Penthouse With Exclusive Rooftop Terrace and Panoramic Ocean Views appeared first on Noosa Today Real Estate Lifestyle.",ONLY AVAILABLE IN PAID PLANS,2025-10-03 00:02:50,UTC,https://realestate.noosatoday.com.au/wp-content/uploads/sites/3/2025/10/nty1_507976_01.jpg,,noosatoday,Noosa Today,888404,https://noosatoday.com.au,https://n.bytvi.com/noosatoday.jpeg,english,['australia'],['tourism'],ONLY AVAILABLE IN PROFESSIONAL AND CORPORATE PLANS,ONLY AVAILABLE IN PROFESSIONAL AND CORPORATE PLANS,ONLY AVAILABLE IN PROFESSIONAL AND CORPORATE PLANS,ONLY AVAILABLE IN CORPORATE PLANS,ONLY AVAILABLE IN CORPORATE PLANS,ONLY AVAILABLE IN PAID PLANS,ONLY AVAILABLE IN PROFESSIONAL AND CORPORATE PLANS,False
9f0dd280ca3ab091c662be654bd554e3,Stunning Noosaville Unit – Location And Lifestyle Combined,https://realestate.noosatoday.com.au/properties/2025/10/03/stunning-noosaville-unit-location-and-lifestyle-combined/,['properties'],['Jin Hui'],"This spacious two-bedroom unit has been beautifully updated and is perfectly positioned to enjoy everything Noosa is famous for. Downstairs, [...]The post Stunning Noosaville Unit – Location And Lifestyle Combined appeared first on Noosa Today Real Estate Lifestyle.",ONLY AVAILABLE IN PAID PLANS,2025-10-03 00:02:26,UTC,https://realestate.noosatoday.com.au/wp-content/uploads/sites/3/2025/10/ntr2_508003_01-1.jpg,,noosatoday,Noosa Today,888404,https://noosatoday.com.au,https://n.bytvi.com/noosatoday.jpeg,english,['australia'],['lifestyle'],ONLY AVAILABLE IN PROFESSIONAL AND CORPORATE PLANS,ONLY AVAILABLE IN PROFESSIONAL AND CORPORATE PLANS,ONLY AVAILABLE IN PROFESSIONAL AND CORPORATE PLANS,ONLY AVAILABLE IN CORPORATE PLANS,ONLY AVAILABLE IN CORPORATE PLANS,ONLY AVAILABLE IN PAID PLANS,ONLY AVAILABLE IN PROFESSIONAL AND CORPORATE PLANS,False
ed7ffc45fbfdec12011a4ce99cdd17a5,"No worries Houston, rural Australia's got space covered",https://www.perthnow.com.au/news/technology/no-worries-houston-rural-australias-got-space-covered-c-20222129,"['technology', 'news']",['Stephanie Gardiner'],"A high-tech Australian mobile space hub will soon hit the road to support remote rocket launches, inspiring the next generation of scientists along the way.",ONLY AVAILABLE IN PAID PLANS,2025-10-03 00:02:13,UTC,https://images.perthnow.com.au/publication/C-20222129/2dff141f879f8c81b4359b8823ce8e90ed9b5080-16x9-x0y0w1280h720.jpg,,perthnow,Perthnow,49457,https://www.perthnow.com.au,https://n.bytvi.com/perthnow.png,english,['australia'],"['top', 'technology']",ONLY AVAILABLE IN PROFESSIONAL AND CORPORATE PLANS,ONLY AVAILABLE IN PROFESSIONAL AND CORPORATE PLANS,ONLY AVAILABLE IN PROFESSIONAL AND CORPORATE PLANS,ONLY AVAILABLE IN CORPORATE PLANS,ONLY AVAILABLE IN CORPORATE PLANS,ONLY AVAILABLE IN PAID PLANS,ONLY AVAILABLE IN PROFESSIONAL AND CORPORATE PLANS,False
8de79a2a14345d7e42f174688c12b16a,"No worries Houston, rural Australia's got space covered",https://thewest.com.au/technology/no-worries-houston-rural-australias-got-space-covered-c-20222127,"['technology', 'premium']",['Stephanie Gardiner'],"A high-tech Australian mobile space hub will soon hit the road to support remote rocket launches, inspiring the next generation of scientists along the way.",ONLY AVAILABLE IN PAID PLANS,2025-10-03 00:02:13,UTC,https://images.thewest.com.au/publication/C-20222127/2dff141f879f8c81b4359b8823ce8e90ed9b5080-16x9-x0y0w1280h720.jpg,,thewest,The West,106740,https://thewest.com.au,https://n.bytvi.com/thewest.png,english,['australia'],"['top', 'technology']",ONLY AVAILABLE IN PROFESSIONAL AND CORPORATE PLANS,ONLY AVAILABLE IN PROFESSIONAL AND CORPORATE PLANS,ONLY AVAILABLE IN PROFESSIONAL AND CORPORATE PLANS,ONLY AVAILABLE IN CORPORATE PLANS,ONLY AVAILABLE IN CORPORATE PLANS,ONLY AVAILABLE IN PAID PLANS,ONLY AVAILABLE IN PROFESSIONAL AND CORPORATE PLANS,True
31bf5c6468576f0c734c0537cd6ecac1,Stonefish Research May Yield New Meds - Mirage News,https://news.google.com/rss/articles/CBMifkFVX3lxTE91eVFyd2JUNTRQZVZRTnhWQmhJaHVKMGhKeTI0OEVBV0ptREZHZTlNa045aldVaHhPbG1qSFo0QlFiVER4dUlES0RWZDR0cVBMc2dHNmFTWWJyeGVxWE5fU0d3WFBxZlBickRRSEgxaDY4bEVTeEZROEZlMTE5Zw?oc=5,,,Stonefish Research May Yield New Meds Mirage News,ONLY AVAILABLE IN PAID PLANS,2025-10-03 00:02:00,UTC,,,google,Google News,14,https://news.google.com,https://n.bytvi.com/google.png,english,['australia'],['science'],ONLY AVAILABLE IN PROFESSIONAL AND CORPORATE PLANS,ONLY AVAILABLE IN PROFESSIONAL AND CORPORATE PLANS,ONLY AVAILABLE IN PROFESSIONAL AND CORPORATE PLANS,ONLY AVAILABLE IN CORPORATE PLANS,ONLY AVAILABLE IN CORPORATE PLANS,ONLY AVAILABLE IN PAID PLANS,ONLY AVAILABLE IN PROFESSIONAL AND CORPORATE PLANS,False
454727b4355a9ed4d95507ec519c8a04,GORDON & MACPHAIL REVEALS 'ARTISTRY IN OAK' DECANTER DESIGN BY ACCLAIMED ARCHITECT JEANNE GANG FOR THE WORLD'S OLDEST SINGLE MALT SCOTCH WHISKY,https://www.prnewswire.com/apac/news-releases/gordon--macphail-reveals-artistry-in-oak-decanter-design-by-acclaimed-architect-jeanne-gang-for-the-worlds-oldest-single-malt-scotch-whisky-302571190.html,,,"ELGIN, Scotland, Oct. 3, 2025 /PRNewswire/ -- Gordon & MacPhail has revealed the 'Artistry in Oak' decanter design by internationally acclaimed American architect Jeanne Gang, marking the release of the oldest single malt Scotch ever bottled – Gordon & MacPhail 85 Years Old from Glenlivet...",ONLY AVAILABLE IN PAID PLANS,2025-10-03 00:01:00,UTC,https://mma.prnewswire.com/media/2785791/Gordon_MacPhail_Hero.jpg?p=original,,prnewswire_apac,Pr Newswire Apac,1822,https://www.prnewswire.com/apac,https://n.bytvi.com/prnewswire_apac.png,english,"['afghanistan', 'india', 'australia', 'singapore', 'fiji', 'maldives', 'japan', 'malaysia', 'china', 'south korea', 'thailand', 'pakistan', 'mongolia', 'brunei', 'new zealand', 'indonesia', 'bhutan', 'philippines', 'hong kong', 'bangladesh', 'nepal', 'sri lanka', 'cambodia']",['business'],ONLY AVAILABLE IN PROFESSIONAL AND CORPORATE PLANS,ONLY AVAILABLE IN PROFESSIONAL AND CORPORATE PLANS,ONLY AVAILABLE IN PROFESSIONAL AND CORPORATE PLANS,ONLY AVAILABLE IN CORPORATE PLANS,ONLY AVAILABLE IN CORPORATE PLANS,ONLY AVAILABLE IN PAID PLANS,ONLY AVAILABLE IN PROFESSIONAL AND CORPORATE PLANS,True
